{"schemaVersion":1,"kind":"reference","id":"REF-1009","title":"Azure Architecture Center","organization":"Microsoft","url":"https://learn.microsoft.com/en-us/azure/architecture/","sourceType":"official-documentation","versionOrDate":"Current architecture catalog accessed 2026-08-07","lessonIds":["LES-0082"],"topics":["reference architectures","technology choices","workloads","patterns","tradeoffs","implementation guidance"],"relevance":"Official catalog used to distinguish reusable reference material from a locally justified architecture with explicit requirements, assumptions and evidence.","usagePolicy":"paraphrase-first","lastReviewed":"2026-08-07","reviewAfter":"2026-11-07"}
