{"schemaVersion":1,"kind":"reference","id":"REF-0934","title":"Placement Groups","organization":"Ceph Foundation","url":"https://docs.ceph.com/en/latest/rados/operations/placement-groups/","sourceType":"official-documentation","versionOrDate":"Ceph development documentation; accessed 2026-08-07","lessonIds":["LES-0078"],"topics":["Ceph","placement group","autoscaler","object mapping","balance","capacity"],"relevance":"Official PG indirection and autoscaling guidance for object-to-PG and PG-to-OSD distribution; PG count changes can create resource and movement consequences.","usagePolicy":"paraphrase-first","lastReviewed":"2026-08-07","reviewAfter":"2027-02-07"}
