{"schemaVersion":1,"kind":"reference","id":"REF-0851","title":"CIS Benchmarks","organization":"Center for Internet Security","url":"https://www.cisecurity.org/cis-benchmarks","sourceType":"standard","versionOrDate":"Living consensus benchmark catalog; accessed 2026-08-07","lessonIds":["LES-0072"],"topics":["secure configuration","hardening baseline","profiles","technology versions"],"relevance":"Official catalog of consensus secure-configuration recommendations and product/version-specific profiles; each baseline must be selected, tailored, tested and versioned.","usagePolicy":"paraphrase-first","lastReviewed":"2026-08-07","reviewAfter":"2026-11-07"}
