{"schemaVersion":1,"kind":"reference","id":"REF-0746","title":"Lineage Ingestion","organization":"OpenMetadata","url":"https://docs.open-metadata.org/v1.12.x/connectors/ingestion/lineage","sourceType":"official-documentation","versionOrDate":"OpenMetadata 1.12.x documentation; accessed 2026-08-05","lessonIds":["LES-0065"],"topics":["lineage","connector","ingestion","pipeline","dashboard"],"relevance":"Official source for connector-ingested lineage and the distinction between observed source metadata and catalog representation.","usagePolicy":"paraphrase-first","lastReviewed":"2026-08-05","reviewAfter":"2027-02-05"}
