{"schemaVersion":1,"kind":"reference","id":"REF-0671","title":"NATS JetStream concepts","organization":"Synadia Communications","url":"https://docs.nats.io/nats-concepts/jetstream","sourceType":"official-documentation","versionOrDate":"current documentation; accessed 2026-08-05","lessonIds":["LES-0060"],"topics":["NATS JetStream","streams","retention","replay","delivery semantics"],"relevance":"Official JetStream model for persistence, retention, replay, publisher acknowledgement, flow control, deduplication and acknowledged consumption.","usagePolicy":"paraphrase-first","lastReviewed":"2026-08-05","reviewAfter":"2027-02-05"}
