{"schemaVersion":1,"kind":"reference","id":"REF-0882","title":"Disaster recovery","organization":"etcd","url":"https://etcd.io/docs/v3.7/op-guide/recovery/","sourceType":"official-documentation","versionOrDate":"etcd 3.7 stable documentation; accessed 2026-08-07","lessonIds":["LES-0074"],"topics":["snapshot","quorum loss","restore","revision bump","integrity"],"relevance":"Official stable etcd recovery guidance for snapshot identity and integrity, recreated cluster membership, revision rollback hazards, revision bumping and Kubernetes watch-cache invalidation.","usagePolicy":"paraphrase-first","lastReviewed":"2026-08-07","reviewAfter":"2027-02-07"}
