{"schemaVersion":1,"kind":"reference","id":"REF-1004","title":"What is the Azure Well-Architected Framework","organization":"Microsoft","url":"https://learn.microsoft.com/en-us/azure/well-architected/what-is-well-architected-framework","sourceType":"official-documentation","versionOrDate":"Current documentation accessed 2026-08-07","lessonIds":["LES-0082"],"topics":["workload design","reliability","security","cost optimization","operational excellence","performance efficiency","tradeoffs"],"relevance":"Official provider framework explicitly connecting business requirements, workload quality, risks, tradeoffs and iterative review across five pillars.","usagePolicy":"paraphrase-first","lastReviewed":"2026-08-07","reviewAfter":"2026-11-07"}
