{"schemaVersion":1,"kind":"reference","id":"REF-0401","title":"Horizontal Pod Autoscaling","organization":"Kubernetes","url":"https://kubernetes.io/docs/tasks/run-application/horizontal-pod-autoscale/","sourceType":"official-documentation","versionOrDate":"Kubernetes v1.36; reviewed 2026-08-04","lessonIds":["LES-0042"],"topics":["HPA","metrics"],"relevance":"Replica feedback algorithm and behavior.","usagePolicy":"paraphrase-first","lastReviewed":"2026-08-04","reviewAfter":"2027-02-04"}
