{"schemaVersion":1,"kind":"reference","id":"REF-0739","title":"Backups","organization":"Apache Software Foundation","url":"https://cassandra.apache.org/doc/stable/cassandra/managing/operating/backups.html","sourceType":"official-documentation","versionOrDate":"Apache Cassandra 5.0 documentation; accessed 2026-08-05","lessonIds":["LES-0065"],"topics":["snapshot","incremental backup","SSTable","schema","restore"],"relevance":"Official source for Cassandra snapshot and incremental-backup mechanics and their local SSTable scope.","usagePolicy":"paraphrase-first","lastReviewed":"2026-08-05","reviewAfter":"2027-02-05"}
