{"schemaVersion":1,"kind":"reference","id":"REF-0937","title":"Health Checks","organization":"Ceph Foundation","url":"https://docs.ceph.com/en/latest/rados/operations/health-checks/","sourceType":"official-documentation","versionOrDate":"Ceph development documentation; accessed 2026-08-07","lessonIds":["LES-0078"],"topics":["Ceph","health","warning","error","full","slow operations","scrub"],"relevance":"Official health-check identifiers and conditions for operator triage; HEALTH_OK cannot replace client I/O, latency, data-integrity or recovery evidence.","usagePolicy":"paraphrase-first","lastReviewed":"2026-08-07","reviewAfter":"2027-02-07"}
