{"schemaVersion":1,"kind":"reference","id":"REF-0961","title":"Chainloading iPXE","organization":"iPXE Project","url":"https://ipxe.org/howto/chainloading","sourceType":"official-documentation","versionOrDate":"Page last modified 2026-03-06; accessed 2026-08-07","lessonIds":["LES-0080"],"topics":["PXE","iPXE","DHCP","TFTP","UEFI network boot","chainloading","boot loops"],"relevance":"Official boot-chain guidance showing first-stage versus second-stage identity, architecture selection and the infinite-chainload-loop failure mode.","usagePolicy":"paraphrase-first","lastReviewed":"2026-08-07","reviewAfter":"2027-02-07"}
