{"schemaVersion":1,"kind":"reference","id":"REF-0386","title":"etcd data model","organization":"etcd","url":"https://etcd.io/docs/v3.6/learning/data_model/","sourceType":"official-documentation","versionOrDate":"Kubernetes v1.36 or etcd v3.6 documentation; reviewed 2026-08-04","lessonIds":["LES-0041"],"topics":["etcd","revisions","watch","compaction"],"relevance":"Primary etcd key, revision, history and watch model.","usagePolicy":"paraphrase-first","lastReviewed":"2026-08-04","reviewAfter":"2027-02-04"}
