{"schemaVersion":1,"kind":"reference","id":"REF-1164","title":"Nova Cells v2","organization":"OpenInfra Foundation and OpenStack Nova project","url":"https://docs.openstack.org/nova/latest/admin/cells.html","sourceType":"official-documentation","versionOrDate":"Nova latest documentation reviewed 2026-08-07","lessonIds":["LES-0091"],"topics":["OpenStack","Nova","cells","failure domains","scale"],"relevance":"Defines API/global and cell-local services, databases, message queues, operational caveats and cross-cell recovery limits.","usagePolicy":"paraphrase-first","lastReviewed":"2026-08-07","reviewAfter":"2026-11-07"}
