{"schemaVersion":1,"kind":"reference","id":"REF-0575","title":"Best practices for Azure Kubernetes Service (AKS)","organization":"Microsoft","url":"https://learn.microsoft.com/en-us/azure/aks/best-practices","sourceType":"official-documentation","versionOrDate":"current documentation reviewed 2026-08-05","lessonIds":["LES-0054"],"topics":["cloud","azure"],"relevance":"AKS security reliability networking scaling and operations guidance","usagePolicy":"paraphrase-first","lastReviewed":"2026-08-05","reviewAfter":"2027-02-05"}
