{"schemaVersion":1,"kind":"reference","id":"REF-0749","title":"Artificial Intelligence Risk Management Framework: Generative Artificial Intelligence Profile","organization":"National Institute of Standards and Technology","url":"https://nvlpubs.nist.gov/nistpubs/ai/NIST.AI.600-1.pdf","sourceType":"standard","versionOrDate":"NIST AI 600-1, July 2024; accessed 2026-08-05","lessonIds":["LES-0066"],"topics":["generative AI","risk","evaluation","content provenance","privacy","security"],"relevance":"Primary cross-sector profile for risks amplified by generative AI and lifecycle risk treatment.","usagePolicy":"paraphrase-first","lastReviewed":"2026-08-05","reviewAfter":"2027-02-05"}
