{"schemaVersion":1,"kind":"reference","id":"REF-0623","title":"Best practices for using webhooks","organization":"GitHub","url":"https://docs.github.com/en/webhooks/using-webhooks/best-practices-for-using-webhooks","sourceType":"official-documentation","versionOrDate":"current documentation accessed 2026-08-05","lessonIds":["LES-0057"],"topics":["webhooks","delivery","operations"],"relevance":"delivery response, redelivery, event identity and operational webhook handling","usagePolicy":"paraphrase-first","lastReviewed":"2026-08-05","reviewAfter":"2027-02-05"}
