{"schemaVersion":1,"kind":"reference","id":"REF-0448","title":"Charts","organization":"Helm","url":"https://helm.sh/docs/topics/charts/","sourceType":"official-documentation","versionOrDate":"Current documentation; reviewed 2026-08-04","lessonIds":["LES-0046"],"topics":["Helm and Kustomize"],"relevance":"Chart structure, metadata, dependencies and versions.","usagePolicy":"paraphrase-first","lastReviewed":"2026-08-04","reviewAfter":"2027-02-04"}
